tema,zn_vix,types,rasr,title,info,dlit,price,silka,platform
Дизайн,Junior,Профессия,есть, Профессия Веб-дизайнер ," Научитесь создавать удобные сайты и приложения, работать с анимацией и презентовать проекты клиентам. Сможете начать карьеру в дизайне и брать первые заказы уже после 8 месяцев интенсивных занятий.Обновлён в 2023 году. ", 12 месяцев обучения , 2 871  ₽/мес  ,https://skillbox.ru/course/profession-webdesigner/,Skillbox
Дизайн,Junior,Профессия,есть, Профессия Графический дизайнер ," Вы с нуля получите востребованную профессию на стыке творчества и IT. Научитесь работать в популярных графических редакторах — от Illustrator до Figma. Добавите в портфолио плакаты, логотипы, дизайн упаковки и другие сильные проекты.Сможете начать зарабатывать уже с 4-го месяца курса. ", 10 месяцев обучения , 3 900  ₽/мес  ,https://skillbox.ru/course/profession-graphdesigner/,Skillbox
Дизайн,Junior,Профессия,есть, Профессия UX/UI-дизайнер ," Вы научитесь разрабатывать удобные сайты и приложения и адаптировать их под разные устройства. Поймёте, как создавать сильные продукты. Освоите востребованную специальность и сможете увеличить свой доход. ", 12 месяцев обучения , 3 900  ₽/мес  ,https://skillbox.ru/course/profession-ux/,Skillbox
Дизайн,Junior,Профессия,есть, Профессия Коммерчес­кий иллюстратор ," Вы научитесь профессионально создавать коммерческие иллюстрации, персонажей и анимацию. Выберете специализацию и подготовите портфолио. Узнаете, как продвигать личный бренд и сделать иллюстрацию основным источником дохода. ", 9 месяцев обучения , 3 955  ₽/мес  ,https://skillbox.ru/course/profession-commercial-illustrator-2/,Skillbox
Дизайн,Junior,Профессия,есть, Профессия Motion-дизайнер ," Motion-дизайнеры создают рекламные ролики, динамичные заставки, анимированные презентации и спецэффекты для кино. Хотите стать одним из них? На курсе вы:• Освоите Cinema 4D и After Effects — профессиональные программы для motion-дизайна.• Научитесь создавать 2D- и 3D-анимации студийного уровня.• Получите востребованную профессию, сможете создавать графику для рекламы и кино в студии или на удалёнке. ", 12 месяцев обучения , 2 581  ₽/мес  ,https://skillbox.ru/course/profession-motiondesigner-new/,Skillbox
Дизайн,Junior,Профессия,есть, Профессия Дизайнер интерьеров ," Вы научитесь преображать дома и квартиры. Узнаете, как создавать чертежи, эффектные рендеры и 3D-визуализации. Получите востребованную профессию, сможете брать высокооплачиваемые заказы или открыть дизайн-студию. ", 12 месяцев обучения , 2 581  ₽/мес  ,https://skillbox.ru/course/profession-interiordesigner/,Skillbox
Дизайн,Junior,Профессия,есть, Профессия Дизайнер жилых и коммерческих интерьеров ," Вы научитесь разрабатывать стильные дизайн-проекты жилых и коммерческих помещений. Будете создавать чертежи, рендеры, 3D-визуализации. Сможете получить востребованную профессию, брать высокооплачиваемые заказы или открыть собственную студию. ", 14 месяцев обучения , 2 581  ₽/мес  ,https://skillbox.ru/course/profession-designer-interior/,Skillbox
Дизайн,Junior,Профессия,есть, Профессия 3D-визуализатор ," Вы с нуля научитесь создавать объёмные визуализации зданий, интерьеров и мебели. Освоите 3ds Max и Photoshop. Получите востребованную специальность и сможете работать с клиентами из любой точки мира. ", 8 месяцев обучения , 4 104  ₽/мес  ,https://skillbox.ru/course/profession-3d-visualizer/,Skillbox
Дизайн,Junior,Профессия,есть, Профессия Ландшафтный дизайнер ," Вы научитесь преображать частные территории. Узнаете, как создавать чертежи и ландшафтные проекты в 3D. Соберёте портфолио, сможете начать карьеру в дизайн-студии или обустроить свой участок. ", 12 месяцев обучения , 2 871  ₽/мес  ,https://skillbox.ru/course/profession-landscape-design/,Skillbox
Дизайн,Junior,Профессия,есть, Профессия Дизайнер интерьеров и ландшафтной среды ," Вы научитесь оформлять интерьеры, проектировать сады и участки, профессионально работать в Archicad, SketchUp и Photoshop. Сможете сделать свой дом уютным и преобразить участок или стать более востребованным специалистом. ", 12 месяцев обучения , 4 806  ₽/мес  ,https://skillbox.ru/course/profession-designer-interior-landscape/,Skillbox
Дизайн,Junior,Курс,есть, Веб-дизайн 3.0 ," С первого дня начнёте практиковаться на реальных задачах. Выполните их в удобном порядке и получите баллы, чтобы попасть на следующий уровень — как в игре. Поработаете с брифами от 7 заказчиков. ", 9 месяцев обучения , 2 581  ₽/мес  ,https://skillbox.ru/course/web-design-3/,Skillbox
Дизайн,Junior,Курс,есть, Графический дизайнер с нуля до PRO ," Вы научитесь создавать элементы фирменного стиля и графику для бизнеса. Соберёте портфолио, которое отразит ваш стиль и подтвердит навыки дизайнера. Сможете начать карьеру в студии или на фрилансе. ", 4 месяца обучения , 4 517  ₽/мес  ,https://skillbox.ru/course/graphic-design/,Skillbox
Дизайн,Junior,Курс,есть, AutoCAD с нуля до PRO ," Вы научитесь делать грамотные и понятные чертежи по ГОСТам, ОСТам и ТУ, разберётесь в интерфейсе и возможностях программы и сможете на профессиональном уровне работать с интерьерами, экстерьерами, архитектурными и строительными проектами. ", 2 месяца обучения , 2 252  ₽/мес  ,https://skillbox.ru/course/autocad/,Skillbox
Дизайн,Junior,Курс,есть, Дизайнер интерьеров с нуля до PRO ," Всего за несколько месяцев вы освоите перспективную и творческую профессию. Сможете устроиться в студию или брать заказы на фрилансе, даже если вы только начинаете свой путь в дизайне. ", 6 месяцев обучения , 2 581  ₽/мес  ,https://skillbox.ru/course/interior-designer-from-scratch-to-pro/,Skillbox
Дизайн,Junior,Курс,есть, Clo 3D для fashion-дизайнеров ," Цифровая мода на подъёме — виртуальную одежду покупают бренды, блогеры и геймеры. А тех, кто её создаёт, мало!На курсе вы:— научитесь создавать виртуальную одежду, обувь и аксессуары;— сможете визуализировать свои модные коллекции;— узнаете, как привлекать внимание брендов, блогеров и разработчиков игр. ", 3 месяца обучения , 3 552  ₽/мес  ,https://skillbox.ru/course/clo3d-for-fashion-designers/,Skillbox
Дизайн,Junior,Курс,есть, Персональный стилист ," Вы научитесь работать с цветом, пропорциями и разными типами фигур. Разберётесь в fashion-брендах и сможете подобрать гармоничный гардероб для любого клиента. Узнаете, как найти первых заказчиков и давать индивидуальные консультации по стилю. ", 4 месяца обучения , 3 427  ₽/мес  ,https://skillbox.ru/course/personal-stylist/,Skillbox
Дизайн,Junior,Курс,есть, Ландшафтный дизайн с нуля ," Вы разберётесь в садовом дизайне, научитесь проектировать участки и работать в разных стилях. Поймёте, как планировать коммуникации, подбирать растения и освещение, презентовать проекты заказчику. ", 4 месяца обучения , 2 822  ₽/мес  ,https://skillbox.ru/course/landscape-design/,Skillbox
Дизайн,Junior,Курс,есть, Blender.Design ," Вы освоите популярную программу для компьютерной графики. Научитесь создавать детализированные сцены, визуализации и работать со сложными эффектами. Сможете делать графику для кино, игр и начать зарабатывать на 3D. ", 2 месяца обучения , 2 960  ₽/мес  ,https://skillbox.ru/course/blender-design/,Skillbox
Дизайн,Junior,Курс,есть, Фотография с нуля до PRO ," Вы узнаете, как делать крутые кадры с помощью любой камеры или телефона. Научитесь снимать в разных жанрах, ретушировать фото, делать цветокоррекцию и выставлять свет. Соберёте портфолио и сможете зарабатывать на любимом деле. ", 4 месяца обучения , 3 226  ₽/мес  ,https://skillbox.ru/course/photography-basics/,Skillbox
Дизайн,Junior,Курс,есть, Кройка и шитьё  ," Вы научитесь подбирать ткани, работать с лекалами и создавать стильную одежду для разных типов фигур. Сможете шить оригинальные вещи для себя или открыть ателье, даже если никогда не держали в руках нитки и иголку. ", 4 месяца обучения , 3 602  ₽/мес  ,https://skillbox.ru/course/cutting-sewing-2/,Skillbox
